{
  "base_program_sha256": "293f96c03a830e2febec330c35c50ff48d323b872fec09e3ef3fecd4cc5d7400",
  "operations": [
    {
      "expected_subtree_sha256": "cabee307ca22756e500679de81c2cac6e59bc9225757976206ce7e847963c5fe",
      "op": "replace_subtree",
      "operation_id": "operation:fresh-1bbfef797e1caad3-fallback",
      "replacement": {
        "node_id": "node:fresh-1bbfef797e1caad3-user-match",
        "none": {
          "node_id": "node:fresh-1bbfef797e1caad3-directory-match",
          "none": {
            "error": {
              "node_id": "node:fresh-1bbfef797e1caad3-missing-code",
              "op": "string",
              "value": "not_found_1bbfef797e1caad3"
            },
            "node_id": "node:fresh-1bbfef797e1caad3-missing",
            "op": "err"
          },
          "op": "option_match",
          "some": {
            "node_id": "node:fresh-1bbfef797e1caad3-directory-found",
            "op": "ok",
            "value": {
              "node_id": "node:fresh-1bbfef797e1caad3-directory-user-ref",
              "op": "var",
              "symbol_id": "local:fresh-1bbfef797e1caad3-directory-user"
            }
          },
          "some_binding": {
            "name": "directoryUser",
            "symbol_id": "local:fresh-1bbfef797e1caad3-directory-user",
            "type": "user"
          },
          "value": {
            "arguments": [
              {
                "node_id": "node:fresh-1bbfef797e1caad3-identifier-for-directory",
                "op": "var",
                "symbol_id": "local:fresh-1bbfef797e1caad3-normalized-id"
              }
            ],
            "node_id": "node:fresh-1bbfef797e1caad3-get-directory-user",
            "op": "call",
            "symbol": "directory.get_by_id"
          }
        },
        "op": "option_match",
        "some": {
          "node_id": "node:fresh-1bbfef797e1caad3-found",
          "op": "ok",
          "value": {
            "node_id": "node:fresh-1bbfef797e1caad3-user-ref",
            "op": "var",
            "symbol_id": "local:fresh-1bbfef797e1caad3-user"
          }
        },
        "some_binding": {
          "name": "user",
          "symbol_id": "local:fresh-1bbfef797e1caad3-user",
          "type": "user"
        },
        "value": {
          "arguments": [
            {
              "node_id": "node:fresh-1bbfef797e1caad3-normalized-for-user",
              "op": "var",
              "symbol_id": "local:fresh-1bbfef797e1caad3-normalized-id"
            }
          ],
          "node_id": "node:fresh-1bbfef797e1caad3-get-user",
          "op": "call",
          "symbol": "users.get_by_id"
        }
      },
      "target_node_id": "node:fresh-1bbfef797e1caad3-user-match"
    }
  ],
  "patch_id": "patch:fresh-1bbfef797e1caad3",
  "program_id": "program:fresh-1bbfef797e1caad3",
  "schema_version": "ai-experiments.semantic-ir.patch/v0"
}
