{
  "base_program_sha256": "79069b057c859df568285db393b3d375c4fbc7156ecd296ad2840819d19c9987",
  "operations": [
    {
      "expected_subtree_sha256": "d4d3a0e5bc57025e00e7fcf4a0a2b502774484c18c929bf557e61023da200589",
      "op": "replace_subtree",
      "operation_id": "operation:fresh-eeb81f32a8a7b14e-normalization",
      "replacement": {
        "node_id": "node:fresh-eeb81f32a8a7b14e-normalizer",
        "op": "var",
        "symbol_id": "param:fresh-eeb81f32a8a7b14e-raw-id"
      },
      "target_node_id": "node:fresh-eeb81f32a8a7b14e-normalizer"
    }
  ],
  "patch_id": "patch:fresh-eeb81f32a8a7b14e",
  "program_id": "program:fresh-eeb81f32a8a7b14e",
  "schema_version": "ai-experiments.semantic-ir.patch/v0"
}
