{
  "base_program_sha256": "41e1e55f6aafc771a80a0456fdd6872308fe0f1f7f248a58398c15f019270f9a",
  "operations": [
    {
      "expected_subtree_sha256": "95c1cc37d4ce8496cfe8af143425f619df26eaa04ba569383e220bf6f93e6bb3",
      "op": "replace_subtree",
      "operation_id": "operation:fresh-49092b08eed8c9a3-normalization",
      "replacement": {
        "arguments": [
          {
            "node_id": "node:fresh-49092b08eed8c9a3-raw-after-normalization-patch",
            "op": "var",
            "symbol_id": "param:fresh-49092b08eed8c9a3-raw-id"
          }
        ],
        "node_id": "node:fresh-49092b08eed8c9a3-normalizer",
        "op": "call",
        "symbol": "string.trim_ascii"
      },
      "target_node_id": "node:fresh-49092b08eed8c9a3-normalizer"
    }
  ],
  "patch_id": "patch:fresh-49092b08eed8c9a3",
  "program_id": "program:fresh-49092b08eed8c9a3",
  "schema_version": "ai-experiments.semantic-ir.patch/v0"
}
