{
  "base_program_sha256": "87284f7c5f5569ec3f1e07154de5459f4458baf0fba04af7e7face58afae87ad",
  "operations": [
    {
      "expected_subtree_sha256": "6250b21a9bf59def8e05a526e44095983f4106986b4c2509ead33834b223f065",
      "op": "replace_subtree",
      "operation_id": "operation:fresh-53c1a1b8d518f1fd-fallback",
      "replacement": {
        "node_id": "node:fresh-53c1a1b8d518f1fd-user-match",
        "none": {
          "node_id": "node:fresh-53c1a1b8d518f1fd-directory-match",
          "none": {
            "error": {
              "node_id": "node:fresh-53c1a1b8d518f1fd-missing-code",
              "op": "string",
              "value": "not_found_53c1a1b8d518f1fd"
            },
            "node_id": "node:fresh-53c1a1b8d518f1fd-missing",
            "op": "err"
          },
          "op": "option_match",
          "some": {
            "node_id": "node:fresh-53c1a1b8d518f1fd-directory-found",
            "op": "ok",
            "value": {
              "node_id": "node:fresh-53c1a1b8d518f1fd-directory-user-ref",
              "op": "var",
              "symbol_id": "local:fresh-53c1a1b8d518f1fd-directory-user"
            }
          },
          "some_binding": {
            "name": "directoryUser",
            "symbol_id": "local:fresh-53c1a1b8d518f1fd-directory-user",
            "type": "user"
          },
          "value": {
            "arguments": [
              {
                "node_id": "node:fresh-53c1a1b8d518f1fd-identifier-for-directory",
                "op": "var",
                "symbol_id": "local:fresh-53c1a1b8d518f1fd-normalized-id"
              }
            ],
            "node_id": "node:fresh-53c1a1b8d518f1fd-get-directory-user",
            "op": "call",
            "symbol": "directory.get_by_id"
          }
        },
        "op": "option_match",
        "some": {
          "node_id": "node:fresh-53c1a1b8d518f1fd-found",
          "op": "ok",
          "value": {
            "node_id": "node:fresh-53c1a1b8d518f1fd-user-ref",
            "op": "var",
            "symbol_id": "local:fresh-53c1a1b8d518f1fd-user"
          }
        },
        "some_binding": {
          "name": "user",
          "symbol_id": "local:fresh-53c1a1b8d518f1fd-user",
          "type": "user"
        },
        "value": {
          "arguments": [
            {
              "node_id": "node:fresh-53c1a1b8d518f1fd-normalized-for-user",
              "op": "var",
              "symbol_id": "local:fresh-53c1a1b8d518f1fd-normalized-id"
            }
          ],
          "node_id": "node:fresh-53c1a1b8d518f1fd-get-user",
          "op": "call",
          "symbol": "users.get_by_id"
        }
      },
      "target_node_id": "node:fresh-53c1a1b8d518f1fd-user-match"
    }
  ],
  "patch_id": "patch:fresh-53c1a1b8d518f1fd",
  "program_id": "program:fresh-53c1a1b8d518f1fd",
  "schema_version": "ai-experiments.semantic-ir.patch/v0"
}
